{
  "artifact_retention": {
    "full_counts": {
      "object_families": 83,
      "objects": 3463,
      "relations": 8000
    },
    "full_lossless_artifact": "left-1.full.json.gz",
    "full_uncompressed_bytes": 5833001,
    "full_uncompressed_sha256": "1c32289308c100547979df0b6bc9c85cd76662f8f5ee54bbb1fd435073579708",
    "index_is_sampled": true
  },
  "input": {
    "block_group_id": "ar_plan_page08",
    "block_id": "blk_0ce1019e612345b48fe5db00037023fa",
    "block_type": "image",
    "blocks_json": "projects_v2/objects/256_Primavera_K14_Spartak/disciplines/AR/documents/СТ26_01-14-АР0-АС-1-РД_V1/versions/v001/02_work/blocks.json",
    "comparison_unit": "ALREADY_PREPARED_GRAPHIC_BLOCK",
    "coords_norm": [
      0.051540165089591305,
      0.0017103762827822121,
      0.5691564324541977,
      0.9341505131128849
    ],
    "crop_url": "https://vibe.cloud-ip.cc/api/crops/2gDbxWuF82vSFl4D3Nv0",
    "document_id": "doc_c6e2e2563ddb41bca06a6ba1c194469c",
    "document_name": "01-14-АР0-АС-1-РД_V1.pdf",
    "document_path": "[АР] Архитектурные решения / СТ26/01-14-АР0-АС-1-РД / 01-14-АР0-АС-1-РД_V1.pdf",
    "export_status": "recognized",
    "graphic_applicability": "GRAPHIC_APPLICABLE",
    "page_artifact": {
      "height_px": 7016,
      "rotation": 0,
      "width_px": 9934
    },
    "page_index": 7,
    "page_label": 8,
    "polygon_points_norm": null,
    "prepared_text_metadata": [
      {
        "anchor_id": "text-1",
        "bbox_norm": [
          0.012059,
          0.729937,
          0.023792,
          0.736573
        ],
        "source": "existing_block_vector_graph.semantic_ledger",
        "text": "П.А"
      },
      {
        "anchor_id": "text-2",
        "bbox_norm": [
          0.187408,
          0.955786,
          0.202506,
          0.962418
        ],
        "source": "existing_block_vector_graph.semantic_ledger",
        "text": "П.11"
      },
      {
        "anchor_id": "text-3",
        "bbox_norm": [
          0.375776,
          0.955786,
          0.390874,
          0.962418
        ],
        "source": "existing_block_vector_graph.semantic_ledger",
        "text": "П.12"
      },
      {
        "anchor_id": "text-4",
        "bbox_norm": [
          0.538856,
          0.955786,
          0.553961,
          0.962418
        ],
        "source": "existing_block_vector_graph.semantic_ledger",
        "text": "П.13"
      },
      {
        "anchor_id": "text-5",
        "bbox_norm": [
          0.732966,
          0.952811,
          0.748064,
          0.959442
        ],
        "source": "existing_block_vector_graph.semantic_ledger",
        "text": "П.14"
      },
      {
        "anchor_id": "text-6",
        "bbox_norm": [
          0.927068,
          0.952811,
          0.942173,
          0.959442
        ],
        "source": "existing_block_vector_graph.semantic_ledger",
        "text": "П.15"
      },
      {
        "anchor_id": "text-7",
        "bbox_norm": [
          0.01099,
          0.111635,
          0.024895,
          0.118264
        ],
        "source": "existing_block_vector_graph.semantic_ledger",
        "text": "П.Ж"
      },
      {
        "anchor_id": "text-8",
        "bbox_norm": [
          0.012261,
          0.200067,
          0.023605,
          0.20669
        ],
        "source": "existing_block_vector_graph.semantic_ledger",
        "text": "П.Е"
      },
      {
        "anchor_id": "text-9",
        "bbox_norm": [
          0.011774,
          0.324638,
          0.024211,
          0.331273
        ],
        "source": "existing_block_vector_graph.semantic_ledger",
        "text": "П.Д"
      },
      {
        "anchor_id": "text-10",
        "bbox_norm": [
          0.012363,
          0.413144,
          0.023548,
          0.419776
        ],
        "source": "existing_block_vector_graph.semantic_ledger",
        "text": "П.Г"
      }
    ],
    "prepared_text_metadata_count": 788,
    "prepared_text_metadata_source": "/home/coder/projects/PDF-proverka/projects_v2/objects/256_Primavera_K14_Spartak/disciplines/AR/documents/СТ26_01-14-АР0-АС-1-РД_V1/versions/v001/03_analysis/runs/fb6add3f-ac42-4e4f-857b-98a9b53b5014/block_vector_graphs/blk_0ce1019e612345b48fe5db00037023fa.json",
    "provenance": [
      "02_work/blocks.json:blocks[]",
      "02_work/blocks.json:pages[]",
      "02_work/document.pdf"
    ],
    "schema_version": "already-prepared-graphic-block-v1",
    "shape_type": "rectangle",
    "source_pdf": "projects_v2/objects/256_Primavera_K14_Spartak/disciplines/AR/documents/СТ26_01-14-АР0-АС-1-РД_V1/versions/v001/02_work/document.pdf",
    "status": "recognized"
  },
  "object_families": [
    {
      "count": 14,
      "family_id": "family_0001",
      "family_signature": "004b231fb9486f38",
      "object_ids": [
        "obj_03162",
        "obj_03163",
        "obj_03176",
        "obj_03177",
        "obj_03179",
        "obj_03183",
        "obj_03186",
        "obj_03189",
        "obj_03190",
        "obj_03191",
        "obj_03447",
        "obj_03450",
        "obj_03452",
        "obj_03455"
      ],
      "provenance": "generic shape/topology signature"
    },
    {
      "count": 2,
      "family_id": "family_0002",
      "family_signature": "01de198978c9c1fa",
      "object_ids": [
        "obj_02489",
        "obj_02829"
      ],
      "provenance": "generic shape/topology signature"
    },
    {
      "count": 2,
      "family_id": "family_0003",
      "family_signature": "02579b9e8fd66ac8",
      "object_ids": [
        "obj_03197",
        "obj_03335"
      ],
      "provenance": "generic shape/topology signature"
    },
    {
      "count": 3,
      "family_id": "family_0004",
      "family_signature": "038bf79b209b865b",
      "object_ids": [
        "obj_01542",
        "obj_01964",
        "obj_02037"
      ],
      "provenance": "generic shape/topology signature"
    },
    {
      "count": 2,
      "family_id": "family_0005",
      "family_signature": "038cd7f92d28b771",
      "object_ids": [
        "obj_03149",
        "obj_03344"
      ],
      "provenance": "generic shape/topology signature"
    },
    {
      "count": 253,
      "family_id": "family_0006",
      "family_signature": "074ee2491cb2e8ff",
      "object_ids": [
        "obj_02219",
        "obj_02220",
        "obj_02222",
        "obj_02223",
        "obj_02224",
        "obj_02225",
        "obj_02227",
        "obj_02228",
        "obj_02229",
        "obj_02232",
        "obj_02236",
        "obj_02237",
        "obj_02238",
        "obj_02239",
        "obj_02240",
        "obj_02241",
        "obj_02242",
        "obj_02244",
        "obj_02248",
        "obj_02249",
        "obj_02250",
        "obj_02251",
        "obj_02252",
        "obj_02267",
        "obj_02268",
        "obj_02269",
        "obj_02274",
        "obj_02275",
        "obj_02276",
        "obj_02277",
        "obj_02281",
        "obj_02282",
        "obj_02284",
        "obj_02286",
        "obj_02287",
        "obj_02288",
        "obj_02289",
        "obj_02291",
        "obj_02292",
        "obj_02293",
        "obj_02300",
        "obj_02301",
        "obj_02302",
        "obj_02391",
        "obj_02392",
        "obj_02395",
        "obj_02397",
        "obj_02399",
        "obj_02402",
        "obj_02403",
        "obj_02405",
        "obj_02407",
        "obj_02411",
        "obj_02413",
        "obj_02415",
        "obj_02531",
        "obj_02532",
        "obj_02534",
        "obj_02536",
        "obj_02538",
        "obj_02542",
        "obj_02544",
        "obj_02546",
        "obj_02549",
        "obj_02551",
        "obj_02553",
        "obj_02555",
        "obj_02557",
        "obj_02559",
        "obj_02565",
        "obj_02567",
        "obj_02568",
        "obj_02570",
        "obj_02572",
        "obj_02574",
        "obj_02576",
        "obj_02578",
        "obj_02580",
        "obj_02582",
        "obj_02584",
        "obj_02586",
        "obj_02588",
        "obj_02590",
        "obj_02593",
        "obj_02595",
        "obj_02597",
        "obj_02599",
        "obj_02601",
        "obj_02603",
        "obj_02605",
        "obj_02606",
        "obj_02609",
        "obj_02612",
        "obj_02614",
        "obj_02619",
        "obj_02622",
        "obj_02624",
        "obj_02626",
        "obj_02627",
        "obj_02629",
        "obj_02632",
        "obj_02636",
        "obj_02883",
        "obj_02884",
        "obj_02886",
        "obj_02888",
        "obj_02889",
        "obj_02891",
        "obj_02893",
        "obj_02895",
        "obj_02897",
        "obj_02899",
        "obj_02901",
        "obj_02903",
        "obj_02905",
        "obj_02906",
        "obj_02908",
        "obj_02910",
        "obj_02913",
        "obj_02915",
        "obj_02918",
        "obj_02920",
        "obj_02923",
        "obj_02929",
        "obj_02931",
        "obj_02933",
        "obj_02935",
        "obj_02937",
        "obj_02939",
        "obj_02941",
        "obj_02943",
        "obj_02945",
        "obj_02946",
        "obj_02949",
        "obj_02951",
        "obj_02953",
        "obj_02955",
        "obj_02957",
        "obj_02959",
        "obj_02961",
        "obj_02963",
        "obj_02965",
        "obj_02967",
        "obj_02970",
        "obj_02972",
        "obj_02974",
        "obj_02976",
        "obj_02978",
        "obj_02979",
        "obj_02981",
        "obj_02984",
        "obj_02986",
        "obj_02987",
        "obj_02988",
        "obj_02993",
        "obj_02995",
        "obj_02997",
        "obj_03000",
        "obj_03002",
        "obj_03003",
        "obj_03006",
        "obj_03008",
        "obj_03010",
        "obj_03013",
        "obj_03015",
        "obj_03017",
        "obj_03019",
        "obj_03020",
        "obj_03023",
        "obj_03025",
        "obj_03027",
        "obj_03028",
        "obj_03030",
        "obj_03032",
        "obj_03034",
        "obj_03036",
        "obj_03038",